"store","websites","attribute_set","type","category_ids","sku","has_options","name","gift_message_available","url_key","url_path","country_of_manufacture","msrp_enabled","msrp_display_actual_price_type","meta_title","meta_description","image","small_image","thumbnail","custom_design","page_layout","options_container","image_label","small_image_label","thumbnail_label","price","special_price","cost","weight","msrp","status","visibility","tax_class_id","is_recurring","em_featured","em_deal","em_hot","description","short_description","meta_keyword","custom_layout_update","news_from_date","news_to_date","special_from_date","special_to_date","custom_design_from","custom_design_to","qty","min_qty","use_config_min_qty","is_qty_decimal","backorders","use_config_backorders","min_sale_qty","use_config_min_sale_qty","max_sale_qty","use_config_max_sale_qty","is_in_stock","low_stock_date","notify_stock_qty","use_config_notify_stock_qty","manage_stock","use_config_manage_stock","stock_status_changed_auto","use_config_qty_increments","qty_increments","use_config_enable_qty_inc","enable_qty_increments","is_decimal_divided","stock_status_changed_automatically","use_config_enable_qty_increments","product_name","store_id","product_type_id","product_status_changed","product_changed_websites"
"admin","base","Default","simple","330,338","10002.00","0","番石榴","No","10002.00","10002.00.html"," ","Use config","Use config","","","/10002.00/1.jpg","/10002.00/1.jpg","/10002.00/1.jpg","default/galayomarket","2 columns with left bar","Product Info Column","","","","4.79","","",".99","","Enabled","Catalog, Search","None","No","","","","奶油果，又名鳄梨，也叫牛油果，是一种含植物油和维他命E很高的水果类，故有“植物黄油”之美誉。奶油果的营养价值不容忽略。美国麻省理工学院的研究人员，从动物实验中发现，奶油果里所含的微量元素“镁”对促进老年记忆力功能。“镁”还有助于缓和经前综合症，偏头痛、焦虑等其它不适。奶油果里所含的脂肪是健康的单一不饱和脂肪，俗称好脂肪，可帮助降低胆固醇水平。奶油果里含很高的可溶性和不可溶性纤维二种：可溶性纤维能帮助清除体内多余的胆固醇；不可溶性纤维能帮助消化系统，预防便秘。奶油果中的天然“叶酸”能预防胎儿先天性神经管缺陷，减少成年人患癌症和心脏病的机率。另外，奶油果难得的高脂低糖，是理想的糖尿病人食品。","一份约2LB","","","","","","","","","0.0000","0.0000","1","0","0","1","1.0000","1","0.0000","1","0","","0.0000","1","0","0","1","1","0.0000","1","0","0","1","1","番石榴","0","simple","",""
"admin","base","Default","simple","330,338","10004","0","龙眼","No","10004","10004.html"," ","Use config","Use config","","","/10004/1.jpg","/10004/1.jpg","/10004/1.jpg","default/galayomarket","2 columns with left bar","Product Info Column","","","","6.99","","",".99","","Enabled","Catalog, Search","None","No","","","","龙眼，又称桂圆，益智，常绿大乔木，树体高大。7～8月果实成熟呈黄褐色时采摘。为无患子科植物，原产于中国南部及西南部，世界上有多个国家和地区栽培龙眼，如：中国，泰国、印度尼西亚、澳大利亚的昆士兰州、美国的夏威夷州和佛罗里达州等。","一份约2LB","","","","","","","","","0.0000","0.0000","1","0","0","1","1.0000","1","0.0000","1","0","","0.0000","1","0","0","1","1","0.0000","1","0","0","1","1","龙眼","0","simple","",""
"admin","base","Default","simple","330,338","10005","0","红苹果（蛇果）","No","10005","10005.html"," ","Use config","Use config","","","/10005/1.jpg","/10005/1.jpg","/10005/1.jpg","default/galayomarket","2 columns with left bar","Product Info Column","","","","3.49","","",".99","","Enabled","Catalog, Search","None","No","","","","原名叫"Red delicious apple"（可口的红苹果）香港人翻译为红地厘蛇果，简约为地厘蛇果。原产于美国的加利福尼亚州，又名红元帅，为红香蕉（元帅）的浓条红型芽变，是世界主要栽培品种之一。中国蛇果产地多为山东、陕西铜川、甘肃天水。 蛇果，其实与蛇一点关系没有，它被音译为“红地厘蛇果”后面就演变成蛇果了，果实大，果实圆锥形，平均单果重200g，大者可达500g以上。可溶性固形物14%，有浓郁的芳香，品质上等。具有生津开胃，消痰止咳，退热解毒，补脑养血，安眠养神，润肺悦心，和脾益气，润肠止泻，帮助消化等功效。","一份5个","","","","","","","","","0.0000","0.0000","1","0","0","1","1.0000","1","0.0000","1","0","","0.0000","1","0","0","1","1","0.0000","1","0","0","1","1","红苹果（蛇果）","0","simple","",""
"admin","base","Default","simple","330,338","10006","0","小红提","No","10006","10006.html"," ","Use config","Use config","","","/10006/1.jpg","/10006/1.jpg","/10006/1.jpg","default/galayomarket","2 columns with left bar","Product Info Column","","","","2.29","","",".99","","Enabled","Catalog, Search","None","No","","","","小红提具早产、丰产、高抗之优良特性，栽后2年即可丰产，单株挂果18公斤。平均穗重700克，最大穗重1300克，平均粒重8-12克．最大粒重16克。含糖18度．上市特早。6月起即可领先群芳，亮相市场。货架期长，常温下可放七天．低温保鲜能贮藏到春节上市。","一份约1LB","","","","","","","","","0.0000","0.0000","1","0","0","1","1.0000","1","0.0000","1","0","","0.0000","1","0","0","1","1","0.0000","1","0","0","1","1","小红提","0","simple","",""
"admin","base","Default","simple","330,338","10007","0","加州橙","No","10007","10007.html"," ","Use config","Use config","","","/10007/1.jpg","/10007/1.jpg","/10007/1.jpg","default/galayomarket","2 columns with left bar","Product Info Column","","","","3.49","","",".99","","Enabled","Catalog, Search","None","No","","","","加州橙，芸香目，芸香科常绿小乔木，小枝无毛，枝刺短或无。叶椭圆形或卵形，全缘或有不显钝齿；叶柄有狭翅，顶端有关节。脐橙营养丰富，含有人体所必需的各类营养成份。脐橙含有大量维生素C和胡萝卜素，有助于抑制致癌物质的形成，还能软化和保护血管，促进血液循环，有助于降低胆固醇和血脂，降低患心脏病的可能，预防胆囊疾病。脐橙含有丰富的维生素，能够预防坏血病的发生。果橙黄色而有绿斑纹。适于盆栽，是观叶，观果佳品。","一份5个","","","","","","","","","0.0000","0.0000","1","0","0","1","1.0000","1","0.0000","1","0","","0.0000","1","0","0","1","1","0.0000","1","0","0","1","1","加州橙","0","simple","",""
"admin","base","Default","simple","330,338","10008","0","卡拉苹果","No","10008","10008.html"," ","Use config","Use config","","","/10008/1.jpg","/10008/1.jpg","/10008/1.jpg","default/galayomarket","2 columns with left bar","Product Info Column","","","","3.49","","",".99","","Enabled","Catalog, Search","None","No","","","","嘎拉苹果1939年选出，1960年发表。果实中等大，单果重180—200克，短圆锥形，果面金黄色。阳面具浅红 晕，有红色断续宽条纹，果型端正美观。果顶有五棱，果梗细长，果皮薄，有光泽。果肉浅黄色，肉质致密、细脆、汁多，味甜微酸，十分适口。品质上乘，较耐贮 藏。幼树结果早，坐果率高，丰产稳产，容易管理。1971年在新西兰又发现一嘎拉浓红型变异，1974年由麦肯齐发表，定名新嘎拉。该品系树性、果形、品质、成熟期等与嘎拉无异但果面着色较浓，呈全面鲜红色，有隐约红色断续条纹，富光泽，甚美观。","一份5个","","","","","","","","","0.0000","0.0000","1","0","0","1","1.0000","1","0.0000","1","0","","0.0000","1","0","0","1","1","0.0000","1","0","0","1","1","卡拉苹果","0","simple","",""
"admin","base","Default","simple","330,338","10009","0","牙买加木瓜","No","10009","10009.html"," ","Use config","Use config","","","/10009/1.jpg","/10009/1.jpg","/10009/1.jpg","default/galayomarket","2 columns with left bar","Product Info Column","","","","2.29","","",".99","","Enabled","Catalog, Search","None","No","","","","木瓜，灌木或小乔木，高达5－10米，叶片椭圆卵形或椭圆长圆形，稀倒卵形，长5－8厘米，宽3.5－5.5厘米，叶柄长5－10毫米，微被柔毛，有腺齿；果实长椭圆形，长10－15厘米，暗黄色，木质，味芳香，果梗短。花期4月，果期9－10月。产山东、陕西、湖北、江西、安徽、江苏、浙江、广东、广西。无论是直接食用还是以之入馔都备受众多食客喜爱。木瓜含有多种酶元素、维生素和矿物质元素，有消暑解渴、润肺止咳的食效。","一份约1LB","","","","","","","","","0.0000","0.0000","1","0","0","1","1.0000","1","0.0000","1","0","","0.0000","1","0","0","1","1","0.0000","1","0","0","1","1","牙买加木瓜","0","simple","",""
"admin","base","Default","simple","330,338","10010","0","大果(葡萄柚)","No","10010","10010.html"," ","Use config","Use config","","","/10010/1.jpg","/10010/1.jpg","/10010/1.jpg","default/galayomarket","2 columns with left bar","Product Info Column","","","","3.49","","",".99","","Enabled","Catalog, Search","None","No","","","","起源于亚洲，是人工种植的树种，是芸香科柑橘属的一种亚热带植物，为常见的水果之一。早期被欧洲人作为装饰盆景、布置庭院使用，后被沙达克船长带到加勒比周围各岛屿，是化妆品、香水的主要原料之一。 在西方，原产中国的胡柚按葡萄牙人的叫法称为葡萄柚；在中国，该柚是柚与柑的杂交种，称为“胡”柚。19世纪中，中国人称葡萄牙人特别喜欢吃的一种中国杂交柚（胡柚）为葡萄柚（Grapefruit）。","一份5个","","","","","","","","","0.0000","0.0000","1","0","0","1","1.0000","1","0.0000","1","0","","0.0000","1","0","0","1","1","0.0000","1","0","0","1","1","大果(葡萄柚)","0","simple","",""
"admin","base","Default","simple","330,338","10011","0","大红提","No","10011","10011.html"," ","Use config","Use config","","","/10011/1.jpg","/10011/1.jpg","/10011/1.jpg","default/galayomarket","2 columns with left bar","Product Info Column","","","","4.69","","",".99","","Enabled","Catalog, Search","None","No","","","","大红提，原产美国,由美国加利福尼亚大学杂交育成。果穗大，长，果粒特大，果柄特长。果穗圆锥形，果粒呈卵圆形，直径在3厘米，平均粒重17克，最大25—35克。果实开始成熟颜色为粉红到深红色，完全成熟为紫红色。果色纯正，美观诱人。果肉脆甜可口，果汁丰富，冰糖味，风味独特，多食不厌，品质极佳。","一份约2LB","","","","","","","","","0.0000","0.0000","1","0","0","1","1.0000","1","0.0000","1","0","","0.0000","1","0","0","1","1","0.0000","1","0","0","1","1","大红提","0","simple","",""
"admin","base","Default","simple","330,338","10012","0","天津鸭梨","No","10012","10012.html"," ","Use config","Use config","","","/10012/1.jpg","/10012/1.jpg","/10012/1.jpg","default/galayomarket","2 columns with left bar","Product Info Column","","","","2.29","","",".99","","Enabled","Catalog, Search","None","No","","","","天津鸭梨，是中国梨的优良品种之一。产地原主要在河北省泊镇等地，通过天津出 口而获名。果形似鸭蛋，梗处有突起，果柄歪斜似鸭嘴，故名鸭梨。天津鸭梨富含蛋白质、脂肪、碳水化合 物、钙、磷、铁、胡萝卜素、核黄素等，有药效，用它熬炼的梨膏，可生津止渴，止咳化痰。天津鸭梨栽培历史悠久，发展现状良好，久负盛名，饮誉海内外，源源 不断销往全国各地，并出口美国、加拿大、澳大利亚、俄罗斯、东南亚等十几个国家和地区。","一份4个","","","","","","","","","0.0000","0.0000","1","0","0","1","1.0000","1","0.0000","1","0","","0.0000","1","0","0","1","1","0.0000","1","0","0","1","1","天津鸭梨","0","simple","",""
"admin","base","Default","simple","330,338","10013","0","奇异果","No","10013","10013.html"," ","Use config","Use config","","","/10013/1.jpg","/10013/1.jpg","/10013/1.jpg","default/galayomarket","2 columns with left bar","Product Info Column","","","","3.49","","",".99","","Enabled","Catalog, Search","None","No","","","","奇异果一般生长在低山区的山林中，一般多出现于高草灌丛、灌木林或次生疏林中。般是椭圆形的。 墨绿色并带毛的表皮一般不食用，而其内则是呈亮绿色的果肉和一排黑色的种子。猕猴桃的质地柔软，味道有时被描述为草莓、香蕉、凤梨三者的混合。因猕猴喜食，故名猕猴桃；亦有说法是因为果皮覆毛，貌似猕猴而得名，是一种品质鲜嫩，营养丰富，风味鲜美，人们喜食的水果，有美容养颜的效果，延迟皮肤衰老的作用，深受各年龄人的喜爱。","一份5个","","","","","","","","","0.0000","0.0000","1","0","0","1","1.0000","1","0.0000","1","0","","0.0000","1","0","0","1","1","0.0000","1","0","0","1","1","奇异果","0","simple","",""
"admin","base","Default","simple","330,338","10015","0","富士苹果","No","10015","10015.html"," ","Use config","Use config","","","/10015/1.jpg","/10015/1.jpg","/10015/1.jpg","default/galayomarket","2 columns with left bar","Product Info Column","","","","4.69","","",".99","","Enabled","Catalog, Search","None","No","","","","富士苹果，是日本农林水产省果树试验场盛冈分场于1939年以国光为母本，元帅为父本进行杂交，历经20余年，选育出的苹果优良品种，于1962年正式命名，是世界上最著名的晚熟苹果品种。","一份5个","","","","","","","","","0.0000","0.0000","1","0","0","1","1.0000","1","0.0000","1","0","","0.0000","1","0","0","1","1","0.0000","1","0","0","1","1","富士苹果","0","simple","",""
"admin","base","Default","simple","330,338","10017","0","美国哈密瓜","No","10017","10017.html"," ","Use config","Use config","","","/10017/1.jpg","/10017/1.jpg","/10017/1.jpg","default/galayomarket","2 columns with left bar","Product Info Column","","","","6.19","","",".99","","Enabled","Catalog, Search","None","No","","","","哈密瓜是甜瓜的一个转变。又名雪瓜、贡瓜，是一类优良甜瓜品种，果型圆形或卵圆形，出产于新疆。味甜，果实大，以哈密所产最为著名，故称为哈密瓜。因为味道甜美，又属于蜜瓜的一种，哈密瓜常被误写为“哈蜜瓜”。维吾尔语称“库洪”，源于突厥语“卡波”，意思即“甜瓜”。哈密瓜有“瓜中之王”的美称，含糖量在15%左右。在诸多哈密瓜品种中，以“红心脆”、“黄金龙”品质最佳。哈密瓜不但好吃，而且营养丰富，药用价值高。哈密瓜有180多个品种及类型，又有早熟夏瓜和晚熟冬瓜之分。冬瓜耐贮存，可以放到来年春天，味道仍然新鲜。","一份约4LB","","","","","","","","","0.0000","0.0000","1","0","0","1","1.0000","1","0.0000","1","0","","0.0000","1","0","0","1","1","0.0000","1","0","0","1","1","美国哈密瓜","0","simple","",""
"admin","base","Default","simple","330,338","10018","0","新疆香梨","No","10018","10018.html"," ","Use config","Use config","","","/10018/1.jpg","/10018/1.jpg","/10018/1.jpg","default/galayomarket","2 columns with left bar","Product Info Column","","","","3.09","","",".99","","Enabled","Catalog, Search","None","No","","","","香梨，维吾尔语叫“奶西姆提”。香梨以库尔勒香梨产量大，质量好。其种植面积达2.4万亩，年产量在千吨以上。 库尔勒香梨在国际市场上被誉为“中华蜜梨”、“梨中珍品”、“果中王子”等称号。香梨具有多种功效，其中包括能保护心脏，减轻疲劳，增强心肌活力，降低血压；另外， 梨所含的配糖体及鞣酸等成分，能祛痰止咳。消热解暑，滋阴养人。","一份约2LB","","","","","","","","","0.0000","0.0000","1","0","0","1","1.0000","1","0.0000","1","0","","0.0000","1","0","0","1","1","0.0000","1","0","0","1","1","新疆香梨","0","simple","",""
"admin","base","Default","simple","330,338","10026","0","沙梨","No","10026","10026.html"," ","Use config","Use config","","","/10026/1.jpg","/10026/1.jpg","/10026/1.jpg","default/galayomarket","2 columns with left bar","Product Info Column","","","","5.29","","",".99","","Enabled","Catalog, Search","None","No","","","","沙梨，蔷薇科梨属，落叶乔木。果圆形， 有时长圆形或卵形，果皮锈色或绿色者， 一般无蒂。 分布于长江沿岸至广东一带。为中国栽培沙梨的基本种，栽培品种多为此种改良而来。蔷薇科梨属，落叶乔木，高达7～15m。小枝光滑，或幼时有绒毛，1～2 年生枝紫褐色或暗褐色。","一份3个","","","","","","","","","0.0000","0.0000","1","0","0","1","1.0000","1","0.0000","1","0","","0.0000","1","0","0","1","1","0.0000","1","0","0","1","1","沙梨","0","simple","",""
"admin","base","Default","simple","330,338","10027","0","沙田柚","No","10027","10027.html"," ","Use config","Use config","","","/10027/1.jpg","/10027/1.jpg","/10027/1.jpg","default/galayomarket","2 columns with left bar","Product Info Column","","","","3.49","","",".99","","Enabled","Catalog, Search","None","No","","","","沙田柚，又称柚子、抛、文旦，芸香科、柑橘属植物，乔木。嫩枝、叶背、花梗、花萼及子房均被柔毛，嫩叶通常暗紫红色，嫩枝扁且有棱。叶质颇厚，色浓绿，阔卵形或椭圆形，广西壮族自治区容县土特产。果梨形或葫芦形，果顶略平坦，有明显环圈及放射沟，蒂部狭窄而延长呈颈状，果期10月下旬以后，属中熟品种。","一份1个","","","","","","","","","0.0000","0.0000","1","0","0","1","1.0000","1","0.0000","1","0","","0.0000","1","0","0","1","1","0.0000","1","0","0","1","1","沙田柚","0","simple","",""
"admin","base","Default","simple","330,338","10029","0","白油桃","No","10029","10029.html"," ","Use config","Use config","","","/10029/1.jpg","/10029/1.jpg","/10029/1.jpg","default/galayomarket","2 columns with left bar","Product Info Column","","","","4.39","","",".99","","Enabled","Catalog, Search","None","No","","","","白油桃是普通桃（果皮外被茸毛）的变种，是一种果实作为水果的落叶小乔木，源于中国的水果，在亚洲及北美洲皆有分布。在中国的西北地区有野生的油桃，当地称为"李光桃"，它对土壤、气候的适应性和栽培技术跟普通桃基本一样。基于过往错误的认识，“桃驳李”被认为是一种把桃嫁接至同属的李树后所结的果子，又或者是桃和李的杂交种，“所以”外表像李子一样光滑，但味道和口感都跟桃子相似。","一份3个","","","","","","","","","0.0000","0.0000","1","0","0","1","1.0000","1","0.0000","1","0","","0.0000","1","0","0","1","1","0.0000","1","0","0","1","1","白油桃","0","simple","",""
"admin","base","Default","simple","330,338","10031","0","皇帝蕉","No","10031","10031.html"," ","Use config","Use config","","","/10031/1.jpg","/10031/1.jpg","/10031/1.jpg","default/galayomarket","2 columns with left bar","Product Info Column","","","","2.99","","",".99","","Enabled","Catalog, Search","None","No","","","","皇帝蕉又称小米蕉、米香蕉、金香蕉，属香芽蕉类，印尼称其为Pisanmas；越南称其为贡蕉，即进贡给皇帝之蕉；缅甸称其为甜蕉。皇帝蕉茎高2．70米左右，亩种植160--180株，从现蕾到收获一般约需60天，从定植到收获约需9--10个月。皇帝蕉果小。长约10厘米左右，无籽，皮薄、熟后皮金黄色，果肉橙黄、清甜芬芳、香甜可口。","一份约2.4LB","","","","","","","","","0.0000","0.0000","1","0","0","1","1.0000","1","0.0000","1","0","","0.0000","1","0","0","1","1","0.0000","1","0","0","1","1","皇帝蕉","0","simple","",""
"admin","base","Default","simple","330,338","10041","0","莱阳梨","No","10041","10041.html"," ","Use config","Use config","","","/10041/1.jpg","/10041/1.jpg","/10041/1.jpg","default/galayomarket","2 columns with left bar","Product Info Column","","","","4.69","","",".99","","Enabled","Catalog, Search","None","No","","","","莱阳梨是胶东名果中的“长者”。梨皮呈绿黄色，粗糙而有黑斑，果形头粗尾细，看去并不美观。但肉质细嫩，甘甜如饴，且清脆可口，品质居各色梨果之上。相传，莱阳茌梨是“邑人于茌平得来”。据调查，茌平历史上并无茌梨栽培。茌梨可能来源于平原县的金香梨。","一份2个","","","","","","","","","0.0000","0.0000","1","0","0","1","1.0000","1","0.0000","1","0","","0.0000","1","0","0","1","1","0.0000","1","0","0","1","1","莱阳梨","0","simple","",""
"admin","base","Default","simple","330,338","10043","0","蜜枣(西梅)","No","10043","10043.html"," ","Use config","Use config","","","/10043/1.jpg","/10043/1.jpg","/10043/1.jpg","default/galayomarket","2 columns with left bar","Product Info Column","","","","4.69","","",".99","","Enabled","Catalog, Search","None","No","","","","西梅，来自美国加州，也称为加州梅。形如杏梅。西梅含有丰富的维生素A及纤维素，同时兼含铁和钾等矿物质，却不含脂肪和胆固醇。西梅不只是一种零食，它和各种原料相配，可做成各种美味食品。西梅不但能当零食吃，还可入菜。无论用来做沙拉、糕点，还是主食、配料，都非常合适。西梅的加工产品也很多，如西梅干、西梅汁、西梅糕等，随身携带，既可以饱口福，又对健康有利。","一份约2LB","","","","","","","","","0.0000","0.0000","1","0","0","1","1.0000","1","0.0000","1","0","","0.0000","1","0","0","1","1","0.0000","1","0","0","1","1","蜜枣(西梅)","0","simple","",""
"admin","base","Default","simple","330,338","10053","0","黄金瓜","No","10053","10053.html"," ","Use config","Use config","","","/10053/1.jpg","/10053/1.jpg","/10053/1.jpg","default/galayomarket","2 columns with left bar","Product Info Column","","","","0.99","","",".99","","Enabled","Catalog, Search","None","No","","","","黄金瓜又名十棱黄金瓜，学术名称为伊丽莎白厚皮甜瓜，因色泽金黄而得名为黄金瓜。黄金瓜营养丰富，有补中益气、消炎止痛，解毒杀虫的作用，对老年人高血压、冠心病、肥胖症等，亦有较好的疗效。黄金瓜花期5～7月，果期7～8月，其实就是平时我们常说的香瓜，黄金瓜是别称。","一份约1LB","","","","","","","","","0.0000","0.0000","1","0","0","1","1.0000","1","0.0000","1","0","","0.0000","1","0","0","1","1","0.0000","1","0","0","1","1","黄金瓜","0","simple","",""
"admin","base","Default","simple","330,338","10054","0","香蕉","No","10054","10054.html"," ","Use config","Use config","","","/10054/1.jpg","/10054/1.jpg","/10054/1.jpg","default/galayomarket","2 columns with left bar","Product Info Column","","","","1.79","","",".99","","Enabled","Catalog, Search","None","No","","","","香蕉在热带地区广泛栽培食用。植株为大型草本，从根状茎发出，由叶鞘下部形成高3～6公尺(10～20尺)的假杆；叶长圆形至椭圆形，有的长达3～3.5公尺(10～11.5尺)，宽65公分(26寸)，10～20枚簇生茎顶。穗状花序大，由假杆顶端抽出，花多数，淡黄色；果序弯垂，结果10～20串，约50～150个。植株结果后枯死，由根状茎长出的吸根继续繁殖，每一根株可活多年。原产亚洲东南部：台湾、海南、广东、广西等地区均有栽培。","一份约2.4LB","","","","","","","","","0.0000","0.0000","1","0","0","1","1.0000","1","0.0000","1","0","","0.0000","1","0","0","1","1","0.0000","1","0","0","1","1","香蕉","0","simple","",""
"admin","base","Default","simple","330,338","10058","0","黄金奇异果","No","10058","10058.html"," ","Use config","Use config","","","/10058/1.jpg","/10058/1.jpg","/10058/1.jpg","default/galayomarket","2 columns with left bar","Product Info Column","","","","3.49","","",".99","","Enabled","Catalog, Search","None","No","","","","全新的新西兰金奇果是以天然方式产生。1977年，新西兰科学家和Zespri研究人员从北京植物园、广西桂林的植物学院以及在中国南部及中部的野生地区所蒐集到的微小ActinidiaChinensis奇异果种子带回，种植在新西兰Te Puke 园艺研究园。 经过多年研究栽种，最后由一棵在北京所产具有黄色果肉和良好口感的母株，以及一棵从桂林所生产，结出大而多汁的果子的父株，共同培植出的新西兰黄金奇异果子株。","一份3个","","","","","","","","","0.0000","0.0000","1","0","0","1","1.0000","1","0.0000","1","0","","0.0000","1","0","0","1","1","0.0000","1","0","0","1","1","黄金奇异果","0","simple","",""
